{
  "partner_id": "click_uz",
  "version": 4,
  "status": "active",
  "senders": [
    { "sender_id": "CLICK", "type": "ALPHANAME", "status": "active" },
    { "sender_id": "5252", "type": "SHORT_NUMBER", "status": "active" }
  ],
  "applications": [
    {
      "application_id": "click_uz_main",
      "display_name": "Click main billing notifications",
      "auth": { "type": "API_KEY", "credential_ref": "vault://partners/click_uz/main/api_key" },
      "ip_allowlist": ["185.65.212.0/24"],
      "rate_limit_tps": 300,
      "allowed_channels": ["SMS"],
      "notification_callback_url": "https://partner-webhook.invalid/mpp/notifications"
    },
    {
      "application_id": "click_uz_marketing",
      "display_name": "Click marketing campaigns",
      "auth": { "type": "API_KEY", "credential_ref": "vault://partners/click_uz/marketing/api_key" },
      "ip_allowlist": ["185.65.212.0/24"],
      "rate_limit_tps": 50,
      "allowed_channels": ["SMS"],
      "notification_callback_url": "https://partner-webhook.invalid/mpp/notifications"
    }
  ]
}
